hook,order,waypoint,cumulative_miles,title_template,body_template,artwork_asset,notes
waypoint_reached,1,Mallow Bend,1.94,{character} reached Mallow Bend,"Two miles on, the path bends past the low water. Greenway Cross lies {miles_to_next} ahead.",,
waypoint_reached,2,Greenway Cross,4.19,Greenway Cross reached,"{character} passes through the green commons. Fenwick Rise climbs {miles_to_next} on.",,
waypoint_reached,3,Fenwick Rise,6.70,{character} reached Fenwick Rise,"The high turn of the route — nearly seven miles walked. Rushmere waits {miles_to_next} ahead.",,
waypoint_reached,4,Rushmere,8.54,Rushmere reached,"Still water below the crags. Just {miles_remaining} left to Cragmouth Gate.",,
journey_complete,5,Cragmouth Gate,10,Cragmouth Gate!,"{character} reaches the canyon shore — {total_miles} walked from Fernhollow to the reservoir gate.",,
